{
  "schema_version": "0.1.0",
  "request_id": "req_opaque",
  "work": {
    "manifest": "work.json",
    "sha256": "9f86d081884c7d659a2feaa0c55ad015a3bf4f1b2b0b822cd15d6c15b0f00a08"
  },
  "placement": {
    "backend": "rooms",
    "profile": "agent-cursor"
  },
  "policy": {
    "deadline_ms": 300000,
    "cancel_grace_ms": 5000
  }
}
